{
  "$schema": "../schemas/ml_platform_contract_v1.contract.json",
  "contract_id": "iris_ml_platform_contract_v1",
  "contract_name": "ml_platform_contract_v1",
  "contract_version": "1.0.0",
  "description": "Authoritative frozen ML <-> Platform integration contract for IRIS.",
  "domains": {
    "cost_overrun": {
      "domain_id": "cost_overrun",
      "domain_name": "Cost Overrun / Escalation Risk (3-Month Horizon)",
      "governance_rationale": "Under PR-07 walk-forward evaluation, cost escalation exhibited extreme class imbalance (~2.18% base rate) and marginal precision lift (PR-AUC < 0.03 micro average precision). Cost revisions are administrative decisions driven by external fiscal and political approvals rather than internal project telemetry. No model is approved for autonomous operational scoring.",
      "governance_status": "NOT_READY_FOR_PRODUCTION",
      "horizon_months": 3,
      "models": {
        "baseline": {
          "artifact": null,
          "calibration": {
            "limitations": "Severe miscalibration due to class rebalancing; Brier score > 0.17 vs 0.017 prevalence baseline.",
            "method": "balanced_class_weight_rescaling",
            "status": "research_only"
          },
          "candidate_type": "baseline",
          "domain": "cost_overrun",
          "explanation": {
            "available": false,
            "contribution_space": "model_margin_or_logit",
            "disclaimer": "Explanations represent non-causal statistical associations based on reporting patterns and model margins. They do not imply causal mechanisms or guaranteed project outcomes.",
            "limitations": "Research-only baseline; low discriminatory power.",
            "method": "LogisticCoefficients",
            "non_causal": true
          },
          "feature_contract": {
            "categorical_features": [
              "sector",
              "agency",
              "state"
            ],
            "contract_reference": "schemas/cost_overrun_v1.contract.json",
            "feature_count": 36,
            "leakage_exclusion_policy": "Strict embargo: only features observable at or before prediction origin month T are permitted.",
            "ordered_names": [
              "sector",
              "agency",
              "state",
              "original_cost",
              "cumulative_expenditure_t",
              "revised_cost_t",
              "physical_progress_t",
              "project_age_months",
              "months_to_original_schedule",
              "months_to_effective_schedule",
              "schedule_revision_lag_months",
              "schedule_has_been_revised",
              "months_since_start",
              "expenditure_to_original_cost_ratio",
              "revised_to_original_cost_ratio",
              "cost_has_been_revised",
              "exp_delta_1m",
              "exp_delta_3m",
              "past_exp_stagnant_3m",
              "past_progress_delta_3m",
              "past_progress_stagnant_3m",
              "n_prior_schedule_extensions",
              "n_prior_cost_revisions",
              "observed_tenure_months",
              "state_is_missing",
              "approval_date_is_missing",
              "original_completion_date_is_missing",
              "revised_cost_is_present",
              "revised_date_is_present",
              "physical_progress_is_present",
              "physical_progress_supported",
              "start_date_is_present",
              "start_date_supported",
              "exp_delta_1m_is_supported",
              "exp_delta_3m_is_supported",
              "progress_delta_3m_is_supported"
            ]
          },
          "governance_status": "NOT_READY_FOR_PRODUCTION",
          "horizon_months": 3,
          "limitations": {
            "eligibility_limitations": "Actively ongoing infrastructure projects with continuous forward 3-month observation and baseline cost > 0.",
            "general_limitations": [
              "Severe class imbalance (~2.18% positive rate).",
              "Near-zero predictive lift over prevalence baseline.",
              "Administrative approvals occur externally to project telemetry."
            ],
            "governance_limitations": "Prohibited for operational scoring, production decision gating, or capital allocation.",
            "regime_limitations": "Evaluated cross-regime under separate fold architectures.",
            "telemetry_limitations": "External political and fiscal approvals driving revisions are unobserved."
          },
          "model_family": "LogisticRegression",
          "model_id": "cost_overrun_baseline_logistic",
          "model_name": "logistic_balanced",
          "model_version": "1.0.0",
          "operational_decision_threshold": null,
          "production_availability": "EVALUATION_ONLY",
          "regime": "CROSS_REGIME",
          "target": "target_effective_cost_esc_3m",
          "target_definition": "Effective administrative upward cost revision / escalation over forward H=3 months window within continuous segment.",
          "validation": {
            "embargo_policy": "strict_walk_forward (T_train + 3 < E_eval)",
            "methodology": "strict_walk_forward_expanding_window (12 LEGACY folds, 5 MODERN folds)",
            "performance_summary": {
              "legacy_macro_ap": 0.03026,
              "legacy_micro_ap": 0.022856,
              "legacy_roc_auc": 0.558448,
              "modern_macro_ap": 0.022169,
              "modern_micro_ap": 0.021013,
              "modern_roc_auc": 0.389548
            }
          }
        },
        "challenger": {
          "artifact": null,
          "calibration": {
            "limitations": "Low absolute probabilities; highest Brier reliability but insufficient precision.",
            "method": "uncalibrated_raw_probabilities",
            "status": "research_only"
          },
          "candidate_type": "challenger",
          "domain": "cost_overrun",
          "explanation": {
            "available": false,
            "contribution_space": "model_margin_or_logit",
            "disclaimer": "Explanations represent non-causal statistical associations based on reporting patterns and model margins. They do not imply causal mechanisms or guaranteed project outcomes.",
            "limitations": "Research-only candidate; feature importance heavily dominated by project age and expenditure ratio.",
            "method": "TreeSHAP",
            "non_causal": true
          },
          "feature_contract": {
            "categorical_features": [
              "sector",
              "agency",
              "state"
            ],
            "contract_reference": "schemas/cost_overrun_v1.contract.json",
            "feature_count": 36,
            "leakage_exclusion_policy": "Strict embargo: only features observable at or before prediction origin month T are permitted.",
            "ordered_names": [
              "sector",
              "agency",
              "state",
              "original_cost",
              "cumulative_expenditure_t",
              "revised_cost_t",
              "physical_progress_t",
              "project_age_months",
              "months_to_original_schedule",
              "months_to_effective_schedule",
              "schedule_revision_lag_months",
              "schedule_has_been_revised",
              "months_since_start",
              "expenditure_to_original_cost_ratio",
              "revised_to_original_cost_ratio",
              "cost_has_been_revised",
              "exp_delta_1m",
              "exp_delta_3m",
              "past_exp_stagnant_3m",
              "past_progress_delta_3m",
              "past_progress_stagnant_3m",
              "n_prior_schedule_extensions",
              "n_prior_cost_revisions",
              "observed_tenure_months",
              "state_is_missing",
              "approval_date_is_missing",
              "original_completion_date_is_missing",
              "revised_cost_is_present",
              "revised_date_is_present",
              "physical_progress_is_present",
              "physical_progress_supported",
              "start_date_is_present",
              "start_date_supported",
              "exp_delta_1m_is_supported",
              "exp_delta_3m_is_supported",
              "progress_delta_3m_is_supported"
            ]
          },
          "governance_status": "NOT_READY_FOR_PRODUCTION",
          "horizon_months": 3,
          "limitations": {
            "eligibility_limitations": "Actively ongoing infrastructure projects with continuous forward 3-month observation and baseline cost > 0.",
            "general_limitations": [
              "Severe class imbalance (~2.18% positive rate).",
              "Micro average precision < 0.03 in both regimes.",
              "External political and fiscal approval dynamics."
            ],
            "governance_limitations": "Prohibited for operational scoring, production decision gating, or capital allocation.",
            "regime_limitations": "Evaluated cross-regime under separate fold architectures.",
            "telemetry_limitations": "External approvals occur outside of project telemetry stream."
          },
          "model_family": "CatBoostClassifier",
          "model_id": "cost_overrun_challenger_catboost",
          "model_name": "catboost_unweighted",
          "model_version": "1.0.0",
          "operational_decision_threshold": null,
          "production_availability": "EVALUATION_ONLY",
          "regime": "CROSS_REGIME",
          "target": "target_effective_cost_esc_3m",
          "target_definition": "Effective administrative upward cost revision / escalation over forward H=3 months window within continuous segment.",
          "validation": {
            "embargo_policy": "strict_walk_forward (T_train + 3 < E_eval)",
            "methodology": "strict_walk_forward_expanding_window (12 LEGACY folds, 5 MODERN folds)",